Nombre Completo;Apellido;Celular WhatsApp;Correo Electronico;Comentarios Adicionales
Sofía;Altieri;1154329876;sofia.altieri@gmail.com;Prefiere café con leche de almendras y atención rápida
Javier;Rossi;1198765432;javier.rossi@yahoo.com.ar;Corte degradé bajo en los costados
Martina;López;1134215678;martina.lopez@outlook.com;Cabello con decoloración previa, requiere cuidado
Bautista;Sosa;1123456789;bautista.sosa@gmail.com;Esmaltado semipermanente negro mate
Delfina;Fernández;1165437890;delfina.f@hotmail.com;Piel sensible a la cera caliente
